{
  "schema_version": "1.0",
  "metadata": {
    "title": "Valid Test Dialogue",
    "author": "Test Author",
    "creation_date": "2025-05-08",
    "description": "A valid test dialogue for validation testing"
  },
  "starting_dialogue": "test_intro",
  "dialogues": [
    {
      "id": "test_intro",
      "npc": "Test NPC",
      "text": "This is a test dialogue for validation.",
      "responses": [
        {
          "id": "response_one",
          "text": "> This is response one",
          "next_dialogue": "test_response_one",
          "script": null,
          "condition": null
        },
        {
          "id": "response_two",
          "text": "> This is response two",
          "next_dialogue": "test_response_two",
          "script": null,
          "condition": null
        }
      ],
      "on_entry": null
    },
    {
      "id": "test_response_one",
      "npc": "Test NPC",
      "text": "You chose response one.",
      "responses": [
        {
          "id": "back_to_start",
          "text": "> Go back to start",
          "next_dialogue": "test_intro",
          "script": null,
          "condition": null
        },
        {
          "id": "end_dialogue",
          "text": "> End dialogue",
          "next_dialogue": null,
          "script": null,
          "condition": null
        }
      ],
      "on_entry": null
    },
    {
      "id": "test_response_two",
      "npc": "Test NPC",
      "text": "You chose response two.",
      "responses": [
        {
          "id": "start_quest",
          "text": "> Start a quest",
          "next_dialogue": "quest_intro",
          "script": "StartQuest_test_quest",
          "condition": null
        },
        {
          "id": "back_to_start",
          "text": "> Go back to start",
          "next_dialogue": "test_intro",
          "script": null,
          "condition": null
        }
      ],
      "on_entry": null
    },
    {
      "id": "quest_intro",
      "npc": "Quest Giver",
      "text": "This is the beginning of a test quest.",
      "responses": [
        {
          "id": "accept_quest",
          "text": "> Accept the quest",
          "next_dialogue": "quest_accepted",
          "script": "UpdateQuest_test_quest_1",
          "condition": null
        },
        {
          "id": "decline_quest",
          "text": "> Decline the quest",
          "next_dialogue": "test_intro",
          "script": null,
          "condition": null
        }
      ],
      "on_entry": null
    },
    {
      "id": "quest_accepted",
      "npc": "Quest Giver",
      "text": "You've accepted the quest. Now go complete it.",
      "responses": [
        {
          "id": "complete_quest",
          "text": "> Complete the quest",
          "next_dialogue": "quest_completed",
          "script": "UpdateQuest_test_quest_2",
          "condition": null
        }
      ],
      "on_entry": null
    },
    {
      "id": "quest_completed",
      "npc": "Quest Giver",
      "text": "Congratulations! You've completed the quest.",
      "responses": [
        {
          "id": "quest_reward",
          "text": "> Receive reward",
          "next_dialogue": "test_intro",
          "script": "CompleteQuest_test_quest",
          "condition": null
        }
      ],
      "on_entry": null
    }
  ],
  "quests": [
    {
      "id": "test_quest",
      "title": "Test Quest",
      "description": "A test quest for validation",
      "stages": [
        {
          "id": 1,
          "description": "Starting the quest",
          "journal_entry": "I've started the test quest.",
          "on_complete": null
        },
        {
          "id": 2,
          "description": "Completing the quest",
          "journal_entry": "I'm finishing the test quest.",
          "on_complete": null
        },
        {
          "id": 3,
          "description": "Quest completed",
          "journal_entry": "I've completed the test quest.",
          "on_complete": null
        }
      ],
      "rewards": {
        "xp": 100,
        "items": ["test_item"]
      }
    }
  ],
  "variables": {
    "test_started": false,
    "quest_completed": false
  }
}